account,name,keywords
@rmrahal@nerdculture.de,Rima-Maria Rahal,open_science replicability reproducibility open_educational_resources
@schultem@scicomm.xyz,Michael Schulte-Mecklenbeck,open_science open_data replicability reproducibility
@epizyklen@nerdculture.de,Maximilian Frank,open_science meta_science replicability reproducibility ECR
@nicebread@scicomm.xyz,Felix Schönbrodt,open_science reproducibility meta_science psychology open_educational_resources
@timolueke@scholar.social,Timo Lüke,open_science open_educational_resources open_publishing
@MalikaIhle@cicomm.xyz,Malika Ihle,open_science open_research reproducibility meta_science open_educational_resources
@aidanhorner@fedscience.org,Aidan Horner,
@wendympatterson@mas.to,Wendy Patterson,open_science diamond_open_access open_chemistry open_infrastructure
@cnsyoung@fediscience.org,Crystal Steltenpohl,diversity_and_inclusion global_engagement open_educational_resources mixed_methods psychology qualitative
